{
  "schemaVersion": "1.0.0",
  "timestamp": 1000,
  "robotId": "compat-rover",
  "operatingMode": "active",
  "globalPose": {
    "frameId": "world",
    "position": { "x": 0, "y": 0, "z": 0 },
    "orientation": { "x": 0, "y": 0, "z": 0, "w": 1 }
  },
  "linearVelocity": { "x": 0, "y": 0, "z": 0 },
  "angularVelocity": { "x": 0, "y": 0, "z": 0 },
  "jointStates": {},
  "actuatorOutputs": {},
  "sensorValues": {},
  "healthIndicators": [],
  "metadata": { "fixture": true }
}
